[
  {
    "chunk_id": "enf_269_2023_ozias_ori_octavio_v_obadiah_oaklen_p001_c001",
    "page_number_1": 1,
    "page_number_0": 0,
    "page_id_internal": "5d3df6d69fac3ef91e13ac835b43a35e9e434fbc7e72ea5c01e288d69b66e6a2_1",
    "page_id_zero_based": "5d3df6d69fac3ef91e13ac835b43a35e9e434fbc7e72ea5c01e288d69b66e6a2_0",
    "page_id_one_based": "5d3df6d69fac3ef91e13ac835b43a35e9e434fbc7e72ea5c01e288d69b66e6a2_1",
    "chunk_order_in_doc": 1,
    "chunk_order_in_page": 1,
    "chunk_type": "heading",
    "section_kind_case": "header",
    "case_number": "ENF 269/2023",
    "case_cluster_id": "oaklen_obadiah_ARB-016-2023_cluster",
    "document_subtype": "order_with_reasons",
    "text_clean": "ENF 269/2023 ... THE DUBAI INTERNATIONAL FINANCIAL CENTRE COURTS ... COURT OF APPEAL",
    "chunk_summary": "Header block with case number, DIFC Courts, and Court of Appeal.",
    "party_roles": [
      {
        "role": "first_applicant",
        "name": "Ozias"
      },
      {
        "role": "second_applicant",
        "name": "Ori"
      },
      {
        "role": "third_applicant",
        "name": "Octavio"
      },
      {
        "role": "defendant_judgment_debtor",
        "name": "Obadiah"
      },
      {
        "role": "claimant_judgment_creditor",
        "name": "Oaklen"
      }
    ],
    "judge_names": [
      "Wayne Martin"
    ],
    "issue_tags": [],
    "authority_refs": [],
    "answer_candidate_types": [
      "names",
      "free_text"
    ]
  },
  {
    "chunk_id": "enf_269_2023_ozias_ori_octavio_v_obadiah_oaklen_p001_c002",
    "page_number_1": 1,
    "page_number_0": 0,
    "page_id_internal": "5d3df6d69fac3ef91e13ac835b43a35e9e434fbc7e72ea5c01e288d69b66e6a2_1",
    "page_id_zero_based": "5d3df6d69fac3ef91e13ac835b43a35e9e434fbc7e72ea5c01e288d69b66e6a2_0",
    "page_id_one_based": "5d3df6d69fac3ef91e13ac835b43a35e9e434fbc7e72ea5c01e288d69b66e6a2_1",
    "chunk_order_in_doc": 2,
    "chunk_order_in_page": 2,
    "chunk_type": "caption_line",
    "section_kind_case": "caption_parties_block",
    "case_number": "ENF 269/2023",
    "case_cluster_id": "oaklen_obadiah_ARB-016-2023_cluster",
    "document_subtype": "order_with_reasons",
    "text_clean": "BETWEEN (1) OZIAS (2) ORI (3) OCTAVIO ... OBADIAH ... OAKLEN",
    "chunk_summary": "Caption parties block identifying applicants/appellants, judgment debtor, and judgment creditor.",
    "party_roles": [
      {
        "role": "first_applicant",
        "name": "Ozias"
      },
      {
        "role": "second_applicant",
        "name": "Ori"
      },
      {
        "role": "third_applicant",
        "name": "Octavio"
      },
      {
        "role": "defendant_judgment_debtor",
        "name": "Obadiah"
      },
      {
        "role": "claimant_judgment_creditor",
        "name": "Oaklen"
      }
    ],
    "judge_names": [
      "Wayne Martin"
    ],
    "issue_tags": [],
    "authority_refs": [],
    "answer_candidate_types": [
      "names"
    ]
  },
  {
    "chunk_id": "enf_269_2023_ozias_ori_octavio_v_obadiah_oaklen_p001_c003",
    "page_number_1": 1,
    "page_number_0": 0,
    "page_id_internal": "5d3df6d69fac3ef91e13ac835b43a35e9e434fbc7e72ea5c01e288d69b66e6a2_1",
    "page_id_zero_based": "5d3df6d69fac3ef91e13ac835b43a35e9e434fbc7e72ea5c01e288d69b66e6a2_0",
    "page_id_one_based": "5d3df6d69fac3ef91e13ac835b43a35e9e434fbc7e72ea5c01e288d69b66e6a2_1",
    "chunk_order_in_doc": 3,
    "chunk_order_in_page": 3,
    "chunk_type": "recital_paragraph",
    "section_kind_case": "recital_block",
    "case_number": "ENF 269/2023",
    "case_cluster_id": "oaklen_obadiah_ARB-016-2023_cluster",
    "document_subtype": "order_with_reasons",
    "text_clean": "UPON the Claimant’s Arbitration Claim Form dated 17 August 2023 in Case No. ARB-016-2023 ... Partial Award dated 10 March 2023 ... Final Award dated 21 June 2023 ...",
    "chunk_summary": "Recital linking the appeal document to ARB-016-2023 and the underlying arbitral awards.",
    "party_roles": [
      {
        "role": "first_applicant",
        "name": "Ozias"
      },
      {
        "role": "second_applicant",
        "name": "Ori"
      },
      {
        "role": "third_applicant",
        "name": "Octavio"
      },
      {
        "role": "defendant_judgment_debtor",
        "name": "Obadiah"
      },
      {
        "role": "claimant_judgment_creditor",
        "name": "Oaklen"
      }
    ],
    "judge_names": [
      "Wayne Martin"
    ],
    "issue_tags": [
      "procedural_linkage"
    ],
    "authority_refs": [
      "ARB-016-2023",
      "Partial Award 2023-03-10",
      "Final Award 2023-06-21"
    ],
    "answer_candidate_types": [
      "date",
      "free_text"
    ],
    "date_mentions": [
      "2023-08-17",
      "2023-03-10",
      "2023-06-21"
    ]
  },
  {
    "chunk_id": "enf_269_2023_ozias_ori_octavio_v_obadiah_oaklen_p002_ord_001",
    "page_number_1": 2,
    "page_number_0": 1,
    "page_id_internal": "5d3df6d69fac3ef91e13ac835b43a35e9e434fbc7e72ea5c01e288d69b66e6a2_2",
    "page_id_zero_based": "5d3df6d69fac3ef91e13ac835b43a35e9e434fbc7e72ea5c01e288d69b66e6a2_1",
    "page_id_one_based": "5d3df6d69fac3ef91e13ac835b43a35e9e434fbc7e72ea5c01e288d69b66e6a2_2",
    "chunk_order_in_doc": 4,
    "chunk_order_in_page": 1,
    "chunk_type": "order_item",
    "section_kind_case": "operative_order_item",
    "case_number": "ENF 269/2023",
    "case_cluster_id": "oaklen_obadiah_ARB-016-2023_cluster",
    "document_subtype": "order_with_reasons",
    "text_clean": "The First Applicant is granted permission to appeal in respect of the proposed ﬁrst ground of appeal only.",
    "chunk_summary": "The First Applicant is granted permission to appeal in respect of the proposed ﬁrst ground of appeal only.",
    "party_roles": [
      {
        "role": "first_applicant",
        "name": "Ozias"
      },
      {
        "role": "second_applicant",
        "name": "Ori"
      },
      {
        "role": "third_applicant",
        "name": "Octavio"
      },
      {
        "role": "defendant_judgment_debtor",
        "name": "Obadiah"
      },
      {
        "role": "claimant_judgment_creditor",
        "name": "Oaklen"
      }
    ],
    "judge_names": [
      "Wayne Martin"
    ],
    "issue_tags": [
      "permission_to_appeal_threshold"
    ],
    "authority_refs": [],
    "order_effect_label": "permission_granted_partial",
    "answer_candidate_types": [
      "boolean",
      "free_text",
      "date"
    ]
  },
  {
    "chunk_id": "enf_269_2023_ozias_ori_octavio_v_obadiah_oaklen_p002_ord_002",
    "page_number_1": 2,
    "page_number_0": 1,
    "page_id_internal": "5d3df6d69fac3ef91e13ac835b43a35e9e434fbc7e72ea5c01e288d69b66e6a2_2",
    "page_id_zero_based": "5d3df6d69fac3ef91e13ac835b43a35e9e434fbc7e72ea5c01e288d69b66e6a2_1",
    "page_id_one_based": "5d3df6d69fac3ef91e13ac835b43a35e9e434fbc7e72ea5c01e288d69b66e6a2_2",
    "chunk_order_in_doc": 5,
    "chunk_order_in_page": 2,
    "chunk_type": "order_item",
    "section_kind_case": "operative_order_item",
    "case_number": "ENF 269/2023",
    "case_cluster_id": "oaklen_obadiah_ARB-016-2023_cluster",
    "document_subtype": "order_with_reasons",
    "text_clean": "The operation of the Part 50 Orders relating to the First Applicant is stayed until further order.",
    "chunk_summary": "The operation of the Part 50 Orders relating to the First Applicant is stayed until further order.",
    "party_roles": [
      {
        "role": "first_applicant",
        "name": "Ozias"
      },
      {
        "role": "second_applicant",
        "name": "Ori"
      },
      {
        "role": "third_applicant",
        "name": "Octavio"
      },
      {
        "role": "defendant_judgment_debtor",
        "name": "Obadiah"
      },
      {
        "role": "claimant_judgment_creditor",
        "name": "Oaklen"
      }
    ],
    "judge_names": [
      "Wayne Martin"
    ],
    "issue_tags": [],
    "authority_refs": [
      "Part 50 Orders"
    ],
    "order_effect_label": "stay_granted_partial",
    "answer_candidate_types": [
      "boolean",
      "free_text",
      "date"
    ]
  },
  {
    "chunk_id": "enf_269_2023_ozias_ori_octavio_v_obadiah_oaklen_p002_ord_003",
    "page_number_1": 2,
    "page_number_0": 1,
    "page_id_internal": "5d3df6d69fac3ef91e13ac835b43a35e9e434fbc7e72ea5c01e288d69b66e6a2_2",
    "page_id_zero_based": "5d3df6d69fac3ef91e13ac835b43a35e9e434fbc7e72ea5c01e288d69b66e6a2_1",
    "page_id_one_based": "5d3df6d69fac3ef91e13ac835b43a35e9e434fbc7e72ea5c01e288d69b66e6a2_2",
    "chunk_order_in_doc": 6,
    "chunk_order_in_page": 3,
    "chunk_type": "order_item",
    "section_kind_case": "operative_order_item",
    "case_number": "ENF 269/2023",
    "case_cluster_id": "oaklen_obadiah_ARB-016-2023_cluster",
    "document_subtype": "order_with_reasons",
    "text_clean": "The First Applicant shall ﬁle and serve his skeleton argument in support of the appeal within fourteen (14) days of the date of this Order.",
    "chunk_summary": "The First Applicant shall ﬁle and serve his skeleton argument in support of the appeal within fourteen (14) days of the date of this Order.",
    "party_roles": [
      {
        "role": "first_applicant",
        "name": "Ozias"
      },
      {
        "role": "second_applicant",
        "name": "Ori"
      },
      {
        "role": "third_applicant",
        "name": "Octavio"
      },
      {
        "role": "defendant_judgment_debtor",
        "name": "Obadiah"
      },
      {
        "role": "claimant_judgment_creditor",
        "name": "Oaklen"
      }
    ],
    "judge_names": [
      "Wayne Martin"
    ],
    "issue_tags": [
      "costs_timetable"
    ],
    "authority_refs": [],
    "order_effect_label": "filing_direction",
    "answer_candidate_types": [
      "free_text"
    ]
  },
  {
    "chunk_id": "enf_269_2023_ozias_ori_octavio_v_obadiah_oaklen_p002_ord_004",
    "page_number_1": 2,
    "page_number_0": 1,